<?xml version="1.0" encoding="utf-8"?>
<TimelineSampleData xmlns:xsi="http://www.w3.org/2001/XMLSchema-instance" xsi:noNamespaceSchemaLocation="TimelineData.xsd">
  <Scenario PatientId="1" Description="Secondary Care Data" BaseDate="18-Mar-2009 12:00:00" TimeFrequencySelectedIndex="9">
    <Section Name="Problems">
      <Row Id="91524294613" Name="diabetes mellitus type 1" Background="#F2F2F2">
        <Item Name="diabetes mellitus type 1" StartDate="14-Aug-1985 00:00:00"/>
      </Row>
      <Row Id="88246271609" Name="diabetic neuropathy" >
        <Item Name="diabetic neuropathy" StartDate="30-Sep-1995 00:00:00"/>
      </Row>
      <Row Id="19802752733" Name="alcoholic" Background="#F2F2F2">
        <Item Name="alcoholic" StartDate="14-Feb-2000 00:00:00"/>
      </Row>
      <Row Id="103716073035" Name="drowsy" MaxLabelStackLevels="2">
        <Item Name="drowsy" StartDate="16-Mar-2006 11:40:00" EndDate="16-Mar-2006 13:10:00"/>
        <Item Name="drowsy" StartDate="05-Jan-2008 11:50:00" EndDate="05-Jan-2008 13:10:00"/>
        <Item Name="drowsy" StartDate="16-Mar-2009 11:50:00" EndDate="16-Mar-2009 13:10:00"/>
      </Row>
      <Row Id="84977821110" Name="diabetic ketoacidosis" MaxLabelStackLevels="2" Background="#F2F2F2">
        <Item Name="diabetic ketoacidosis" StartDate="16-Mar-2006 12:00:00" EndDate="23-Mar-2006 23:59:00"/>
        <Item Name="diabetic ketoacidosis" StartDate="05-Jan-2008 12:10:00" EndDate="12-Jan-2008 23:59:00"/>
        <Item Name="diabetic ketoacidosis" StartDate="16-Mar-2009 12:10:00"/>
      </Row>
      <Row Id="35937449931" Name="infected foot : left" MaxLabelStackLevels="2">
        <Item Name="infected foot : left" StartDate="16-Mar-2006 12:00:00" EndDate="18-Mar-2006 09:35:00"/>
        <Item Name="infected foot : left" StartDate="05-Jan-2008 12:10:00" EndDate="07-Jan-2008 22:00:00"/>
        <Item Name="infected foot : left" StartDate="16-Mar-2009 12:10:00"/>
      </Row>
      <Row Id="17573944330" Name="urinary tract infection" MaxLabelStackLevels="2" Background="#F2F2F2">
        <Item Name="urinary tract infection" StartDate="16-Mar-2006 12:00:00" EndDate="23-Mar-2006 23:59:00"/>
        <Item Name="urinary tract infection" StartDate="05-Jan-2008 12:10:00" EndDate="12-Jan-2008 23:59:00"/>
        <Item Name="urinary tract infection" StartDate="16-Mar-2009 12:10:00"/>
      </Row>
      <Row Id="12868318557" Name="systemic sepsis">
        <Item Name="systemic sepsis" StartDate="18-Mar-2009 09:35:00"/>
      </Row>
      <Row />
    </Section>
    <Section Name="Medications">
      <Row Id="75123623608" Name="insulin" Description="— MIXTARD" MaxLabelStackLevels="3" Background="#F2F2F2">
        <Item Name="insulin" Type="SecondaryCareMedication" StartDate="30-Sep-1995 00:00:00" EndDate="16-Mar-2006 11:40:00">
          <Brand>MIXTARD</Brand>
          <Form>injection</Form>
          <DoseLabel>DOSE</DoseLabel>
          <Dose>variable</Dose>
          <Route>subcutaenous</Route>
          <Frequency>as required</Frequency>
          <Events>
            <Event Type="administrations" ActualStartDate="30-Sep-1995 00:00:00" ActualEndDate="16-Mar-2006 11:40:00" Status="completed">
              <Comments></Comments>
              <Clinician></Clinician>
            </Event>
          </Events>
        </Item>
        <Item Name="insulin" Type="SecondaryCareMedication" StartDate="24-Mar-2006 00:00:00" EndDate="05-Jan-2008 11:40:00">
          <Brand>MIXTARD</Brand>
          <Form>injection</Form>
          <DoseLabel>DOSE</DoseLabel>
          <Dose>variable</Dose>
          <Route>subcutaenous</Route>
          <Frequency>as required</Frequency>
          <Events>
            <Event Type="administrations" ActualStartDate="24-Mar-2006 00:00:00" ActualEndDate="05-Jan-2008 11:40:00" Status="completed">
              <Comments></Comments>
              <Clinician></Clinician>
            </Event>
          </Events>
        </Item>
        <Item Name="insulin" Type="SecondaryCareMedication" StartDate="13-Jan-2008 00:00:00" EndDate="16-Mar-2009 11:40:00">
          <Brand>MIXTARD</Brand>
          <Form>injection</Form>
          <DoseLabel>DOSE</DoseLabel>
          <Dose>variable</Dose>
          <Route>subcutaenous</Route>
          <Frequency>as required</Frequency>
          <Events>
            <Event Type="administrations" ActualStartDate="13-Jan-2008 00:00:00" ActualEndDate="16-Mar-2009 11:40:00" Status="completed">
              <Comments></Comments>
              <Clinician></Clinician>
            </Event>
          </Events>
        </Item>
      </Row>
      <Row Id="37692425250" Name="sodium chloride" Description=" 0.9%" MaxLabelStackLevels="3" ShowLabelOvercrowdingNotifications="True">
        <Item Name="sodium chloride" Type="SecondaryCareMedication" StartDate="16-Mar-2006 11:40:00" EndDate="16-Mar-2006 12:10:00">
          <FluidStrength>0.9%</FluidStrength>
          <Form>infusion</Form>
          <DoseLabel>VOLUME</DoseLabel>
          <Dose>1 L</Dose>
          <DoseDuration>over 30 minutes</DoseDuration>
          <Route>intravenous</Route>
          <Frequency>once only</Frequency>
          <Events>
            <Event Type="administrations" ActualStartDate="16-Mar-2006 11:40:00" ActualEndDate="16-Mar-2006 12:10:00" Status="completed">
              <Comments></Comments>
              <Clinician></Clinician>
            </Event>
          </Events>
        </Item>
        <Item Name="sodium chloride" Type="SecondaryCareMedication" StartDate="16-Mar-2006 12:10:00" EndDate="16-Mar-2006 13:10:00">
          <FluidStrength>0.9%</FluidStrength>
          <Form>infusion</Form>
          <DoseLabel>VOLUME</DoseLabel>
          <Dose>1 L</Dose>
          <DoseDuration>over 1 hour</DoseDuration>
          <Route>intravenous</Route>
          <Frequency>once only</Frequency>
          <Events>
            <Event Type="administrations" ActualStartDate="16-Mar-2006 12:10:00" ActualEndDate="16-Mar-2006 13:10:00" Status="completed">
              <Comments></Comments>
              <Clinician></Clinician>
            </Event>
          </Events>
        </Item>
        <Item Name="sodium chloride" Type="SecondaryCareMedication" StartDate="16-Mar-2006 13:10:00" EndDate="16-Mar-2006 15:10:00">
          <FluidStrength>0.9%</FluidStrength>
          <Form>infusion</Form>
          <DoseLabel>VOLUME</DoseLabel>
          <Dose>1 L</Dose>
          <DoseDuration>over 2 hours</DoseDuration>
          <Route>intravenous</Route>
          <Frequency>once only</Frequency>
          <Events>
            <Event Type="administrations" ActualStartDate="16-Mar-2006 13:10:00" ActualEndDate="16-Mar-2006 15:10:00" Status="completed">
              <Comments></Comments>
              <Clinician></Clinician>
            </Event>
          </Events>
        </Item>
        <Item Name="sodium chloride" Type="SecondaryCareMedication" StartDate="16-Mar-2006 15:10:00" EndDate="23-Mar-2006 22:00:00">
          <FluidStrength>0.9%</FluidStrength>
          <Form>infusion</Form>
          <DoseLabel>VOLUME</DoseLabel>
          <Dose>2 L</Dose>
          <DoseDuration>over 24 hours</DoseDuration>
          <Route>intravenous</Route>
          <Frequency>once only</Frequency>
          <Events>
            <Event Type="administrations" ActualStartDate="16-Mar-2006 15:10:00" ActualEndDate="23-Mar-2006 22:00:00" Status="completed">
              <Comments></Comments>
              <Clinician></Clinician>
            </Event>
          </Events>
        </Item>
        <Item Name="sodium chloride" Type="SecondaryCareMedication" StartDate="05-Jan-2008 11:40:00" EndDate="05-Jan-2008 12:10:00">
          <FluidStrength>0.9%</FluidStrength>
          <Form>infusion</Form>
          <DoseLabel>VOLUME</DoseLabel>
          <Dose>1 L </Dose>
          <DoseDuration>over 30 minutes</DoseDuration>
          <Route>intravenous</Route>
          <Frequency>once only</Frequency>
          <Events>
            <Event Type="administrations" ActualStartDate="05-Jan-2008 11:40:00" ActualEndDate="05-Jan-2008 12:10:00" Status="completed">
              <Comments></Comments>
              <Clinician></Clinician>
            </Event>
          </Events>
        </Item>
        <Item Name="sodium chloride" Type="SecondaryCareMedication" StartDate="05-Jan-2008 12:10:00" EndDate="05-Jan-2008 13:10:00">
          <FluidStrength>0.9%</FluidStrength>
          <Form>infusion</Form>
          <DoseLabel>VOLUME</DoseLabel>
          <Dose>1 L </Dose>
          <DoseDuration>over 1 hour</DoseDuration>
          <Route>intravenous</Route>
          <Frequency>once only</Frequency>
          <Events>
            <Event Type="administrations" ActualStartDate="05-Jan-2008 12:10:00" ActualEndDate="05-Jan-2008 13:10:00" Status="completed">
              <Comments></Comments>
              <Clinician></Clinician>
            </Event>
          </Events>
        </Item>
        <Item Name="sodium chloride" Type="SecondaryCareMedication" StartDate="05-Jan-2008 13:10:00" EndDate="05-Jan-2008 15:10:00">
          <FluidStrength>0.9%</FluidStrength>
          <Form>infusion</Form>
          <DoseLabel>VOLUME</DoseLabel>
          <Dose>1 L </Dose>
          <DoseDuration>over 2 hours</DoseDuration>
          <Route>intravenous</Route>
          <Frequency>once only</Frequency>
          <Events>
            <Event Type="administrations" ActualStartDate="05-Jan-2008 13:10:00" ActualEndDate="05-Jan-2008 15:10:00" Status="completed">
              <Comments></Comments>
              <Clinician></Clinician>
            </Event>
          </Events>
        </Item>
        <Item Name="sodium chloride" Type="SecondaryCareMedication" StartDate="05-Jan-2008 15:10:00" EndDate="12-Jan-2008 22:10:00">
          <FluidStrength>0.9%</FluidStrength>
          <Form>infusion</Form>
          <DoseLabel>VOLUME</DoseLabel>
          <Dose>2 L</Dose>
          <DoseDuration>over 24 hours</DoseDuration>
          <Route>intravenous</Route>